text,percent
"No se dejen engañar: Evita era una prostituta, anti feminismo y no era la abanderada de los humildes, vivía rodeada de riquezas. ",0.7
"Por qué piko taaaan grandes las nuevas tetas de Nadia la Kchorra, amigos ",0.875
"La Casa Blanca advierte que ""todas las opciones"" están sobre la mesa en relación a Venezuela |  ""EEUU anunció sanciones contra PDVSA, para evitar que el régimen de Nicolás Maduro siga robándose los activos de los venezolanos"". ",0.075
"Mariquita.",0.975
"Me gustó un video de   FANTASMA EN EL HOSPITAL: HISTORIA REAL | DOCTOR VIC",0
" Sí jajaja cobro más que toda mi familia completa",0.025
"El vecino escualido me dice aquí nos salva es una invasión. Le dije aquí los brutos somos los chavistas deja la envidia!!",0.95
"Tomar dos litros de agua te ayuda a la liberación de toxinas, fortalecimiento del sistema inmune, entre otros beneficios.",0
"No, nada de propaganda, eso es lo que quieren hacer creer. Es un texto, es cultura. Que (desde mi punto de vista) todos debieran leer y tener cada quien su opinión, como te digo, no es doctrina, lo importante es despertar el pensamiento crítico. Que vaya que hace falta.",0.625
"  Mariquita!",0.975
" Si tomas cerveza que se note ",0.175
" Vinieron a cobrar la deuda en oro xq saben que en enero el TRIMARDITO se va",0.925
"Los hombres son tan asquerosos se atajan de la lucha de las mujeres ""gente buena contra gente mala"" pero siguen teniendo las mismas actitudes machistas con la primer mujer que se les cruce. Chicos el cambio tambien esta en ustedes, no sean ignorantes!",0.875
"Quiero recordar que fue Hugo Chávez quien primero dijo que había que salir de Citgo porque era una carga muy pesada para Pdvsa. Y fue Maduro quien hipotecó Citgo a los rusos. Esa es la verdad.",0.125
"Hoy me tiene harto que celebren como héroe/víctima a periodistas que quieren que los venezolanos desconozcan a Maduro pero acatan las órdenes de censura de CONATEL.",0.4
" Es un estúpido me tiene harta, a nosotras nos trata como quiere en casa y después se pone la careta de buen pibe",0.875
"Bueno genia de la lectura ya que sabes tanto me podrías iluminar y explicarme desde la ciencia cuando comienza la vida por favor",0
"puta porque me hablas cagada de la mina si después le vas a chupar el culo??? al final terminas siendo todo lo q criticas",0.9
"Inflación Nicolás Maduro, salarios Nicolás Maduro, desocupación Nicolás Maduro, pobreza Nicolás Maduro, recesión Nicolás Maduro, presupuesto de ciencia Nicolás Maduro. Todos los logros de la gestión macrista se redujeron a Nicolás Maduro.",0.4
"Quieren señales??? Deroguen el impuesto más imbécil que tiene este país: el de la renta financiera. Un capricho necio de Massa y peronistas que representa el 0,14% de recaudación de la Afip y ahuyenta inversiones financieras. Aprendan a sumar, políticos inútiles!!!",0.85
"No hay correlación de discriminación por piel y la pregunta de la ""cabra culia"" - infiero que una niña-. ",0.325
"Le tira el quilombo al capo mafia del viejo Franco Macri q está muy enfermo y será el pato de la boda q cargará con todas las culpas Estrategia de Manual!!!",0.55
"Gracias al profesor Francisco Marin por organizar el acto religioso para conmemorar el día del maestro. Bello momentos donde se logro reunir a un gran numero de educadores que hacen vida…",0.05
"No demuestro un carajo, pero siento un montón.",0.3
"mardito, trimardito, cabeza e webo, pan con huevo, aweboniado, pajuo, mongolico, jalabolas, coño e tu madre, muchacho marico, caido de la mata, cabeza e ponque, marico triste, becerro, bruja, traga sable, toche, bicho, malpario, cuaima, coño e tu pepa, comemierda, webon,",1
" Jajaja, de lo peorcito, como dicen en Venezuela: 'el propio jalabolas' en ambos sentidos.",0.525
" Ha este negro hijo de puta hay es que cerrarle la cuenta mucho desgraciado",0.925
"Os dejo con un vídeo del primer partido de en Ligue 1 con el , repito primer partido, para que veáis cómo ve el fútbol este fenómeno. Infinidad de detalles que muestran a un jugador soberbio con una mente brillante.",0
"México se transformará en EL PARAÍSO DEL GUEVON, pues  ofrece dar más dinero a ninis que no hacen nada que a tracalear",0.85
"URGENTE a mis amigos y familiares en Venezuela compren alimentos por lo menos para 1 semana, luego entrará la ayuda humanitaria , la intervención militar es 100% seguro, la FAN no va a resistir mas de 48 horas de combate , que dios se apiade de nosotros",0.025
"Tengo demasiada ira acumulada y esta computadora solo me hace explotar de la peor manera
Es demasiado frustrante",0.275
" : dave: dale marico, anda pa'llápapá de dave: dale chamito dalelinda: verga mamawebo dale o te caigo coñazo",0.85
" : Ay mi vida tenes un mani de pito y te queres hacer el lindo estúpido ortopédico",0.525
"una foto de tu perro bastará para conquistarme",0.025
" En Venezuela",0
"Me pregunto yo , ¿uno como un simple ciudadano no puede hacer nada para que desaforen a este desgraciado? ",0.625
"Gafo lo tuyo fue tu culpa ",0.5
"El tema de que el #10yearchallenge se pueda estar usando para alimentar redes neuronales de reconocimiento facial es interesante. ",0
"China puso cerca de $90.000 millones en América Latina entre 2005 y 2016. En 2017 fueron $18.000 millones. Para este año las expectativas son aún mayores.",0.025
"Paraguay está en Latinoamérica. Latinoamérica usa el 0,4% de la  energía  eléctrica que se  produce en el mundo y el consumo paraguayo es el 0,007% de ese 0,4%. Pesamos tan poco en todas  estas  tablas que  apenas  somos     responsables  del 0,1% del CO2",0.025
"nforma a la opinión pública el decreto 2362 del 24 de diciembre del 2018 expedido por el gobierno nacional, por el cual se adoptan medidas para la suspensión general de permisos para el porte de armas de fuego en Colombia. ",0.025
"Jalabolas commies...
 Jalabolas corporativos...
Jalabolas del jalabolas...

Estamos llenos de Smithers ",0.8
"Una fuente de la cancillería de Brasil asegura que 300 militares de Israel que llegaron a ese país vienen en misión de colaborar en labores de rescate por tragedia al colapsar represa en mina. ""No tiene nada que ver con el tema Venezuela"", asegura.- ",0.075
"Le acaban de decir una guarrada a la piba mía en la calle y le grité ""no ves que es una nena, pajero enfermo"" bajó la cabeza y la gente lo miró mal. Hace un tiempo hubiéramos bajado nosotras la cabeza y nos quedábamos con la vergüenza. Hoy se la llevó él. Gracias chicas.",0.3
"La sonrisa es el idioma universal de los hombres inteligentes, Victor Ruiz Iriarte  #frases #quotes",0.025
"q ganas de mandarlos todos a la mierda",0.875
"Jóvenes de toda la región podrán participar en el sexto campamento latinoamericano de ciencia en Lavalleja ",0
"Ministerio de Ciencia y Tecnología (CITMA) y Centros de Investigaciones cubanos conmemoran el 15 de enero como Día de la Ciencia Cubana, creado por #Fidel en 1960, realizando jornadas científicas, discusión de trabajos y resultados destacados de nuestra ciencia.",0
"Más El viernes en el banco salía llorando en una silla de ruedas una viejita que le habían dicho que su miserable bono no lo habían hecho efectivo porque la página de pago estaba en reconstrucción. ¡Maldito! por eso tu Dios te tiene sin poder caminar... por maldito.",0.725
"La belleza de la compañía..",0.025
"Lo tienes todo, hasta ese estupido carácter que me hace verme en ti.",0.7
"Buenas, hoy les vengo a pedir una mano: Estoy buscando alguien q se cope en llevar a dar una vuelta en avioneta o algo así a un alumno cuyo sueño fue volar desde niño.  Vale remarcar q tiene 80 añitos y nunca pudo hacerlo porque labura desde los 12.",0.025
"Si piensas que todo el mundo en el fondo es bueno, es porque te falta muchísima mierda por comer.",0.9
"Hace menos de un mes que atracaron a mi señora madre poniéndola un machete en el cuello.",0.3
"Jajajaj¿ Presiones de izquierda o el cagazo que tiene en su «honorable» institución?",0.95
"Tómate un par de segundos, para pensar sobre tu estúpido twitt... ",0.7
"Yo recuerdo que decían que pasaria lo contrario si AMLO ganaba...  donde estaran todos esos economistas que querian asustar usando frases asi?",0.425
"O te tocaron el culo, la teta, o te agarran de la cintura en un boliche.. estanfo sobria o mamada, y sos una histérica que no te garchan XQ DECIS QUE NO!",1
" Nojoda meneses cagon",0.875
" El arte de ser marico",0.975
"ómenla cabrones corruptos de la como verán en este vídeo, ya hicieron enojar al pueblo. Hey Eduardo Medina Mora, la gente tiene el derecho de reclamar tu maldito cinismo, nosotros pagamos tu sueldo millonario! ",0.85
"No he comido en más de 24 horas, lloré toda la noche y estoy perdiendo sangre a lo estupido porque estoy en mis día… ",0.275
"Perdiste permanentemente datos de tu Pendrive, computadora, tablet, smartphone u otros dispositivos informáticos? Tranquilo... existen formas gratuitas y fáciles para recuperarles por ti mismo",0.05
"Que hueva que vuelvan a lo mismo y que ensucien lo bonito qué pasó hoy, el amor, La Paz y la inclusión que nos dio",0.425
"De tal perro, tal perra... maldita puta  ",0.95
" El hombre que aparenta ser el guevon más grande del mundo.. Y cagá una tragavenada...",0.575
"Si le habremos sido infiel al vino toro con alguno de estos... ",0.075
" Ah listo me siento la mina mas fea de este puto mundo ",0.75
"Marica, usted es todo lo que yo quiero cogerme esta noche.",0.575
"Pero que COÑO es esto",0.95
" Mejora tu salud y combate afecciones comunes gracias al deporte y sobre todo a una buena alimentación #Consejos ",0.05
"Asi las cosas...  Si votaste por MORENA y te asaltan, roban en casa o quitan tu carro, tranquilo, son delitos menores, si te violan, tambien es un delito menor. Tal cual ",0.025
"No les pasa que a veces miran a alguien que les gusta mucho, o que quieren y piensan joder, es que es una puta obra de arte",0.8
" Degenerado. Y ella seguro lo sabe y lo consiente",0.525
" Aunque no es divertido jaja. Saludos!",0.025
"Pues se ve divertido. Y no corre riesgo ninguno de los dos. 
Lo de la falda es fantástico. Jejejej. ",0.025
"  A mi me parece más sexy la ropa interior negra que roja can’t change my mind",0
"Ya empezaron los rumores con el color de cabello de los chicos...",0.1
".... felicidades... buen trabajo..... ahora por favor... denle seguimiento hasta las últimas consecuencias...e informen a la gente     gracias ",0
"Pedazo de sorete se solidario con las personas a las q estafo y con todos los Argentinos a los q no robo,pero cuando no el populismo latinoamericano SIEMPRE del lado de los delicuentes,pero suerte de a poquito estan dejando de existir",0.35
"Recomiendo “Luciano Mellera: Infantiloide” en Netflix - Muy gracioso este argentino. Gran dominio de escena. ⁦ Algunas partes de su comedia es hilarante y en general divertido",0
"Gracias por escribir, remitiremos tu comentario al área de programación para ver la posibilidad que programen películas en su idioma original.",0.05
"MIRA COMO NOS PONEMOS hijo de puta.
Se va a caer",0.95
"quizas vaya al barza, meta algunos goles, eso no le quita que su carrera se vino abajo por puto, se la pasa de enamoradizo por todos lados menos futbol. lastima.",0.65
"   Método 100% comprobado y efectivo. Genio Marcelo",0.025
"    No si tonto no esta estás pendejo defender lo indefendible estúpido eres",0.925
"Inscripciones abiertas desde hoy 14 de enero al 18. Fórmate en carreras #AgroSENA con ciencia, tecnología, innovación y emprendimiento ",0.05
"Perdona el atrevimiento, ¿Se graduan de jalabolas? Animal con ojos?  De cdsm? O las tres nominaciones juntas porque el doctorado los gradua de hdlgp",0.95
"Bien desafortunado el comentario, este tema es muy sensible para quienes no tienen otra opción que esperar, un montón de tiempo para tomar alguna hora y ni pensar el tiempo para realizarse un examen, de chiste no tiene NADA! Desbocada.",0.5
"  Jajajajaja por lo que veo, eres muy necio",0.525
"Esta foto de la gente feliz, ¿Será un montaje ?... A cuántos reunió con cara de felicidad? , ¿pagaron para que posarán? y cuántos buses contrataron para reunirlos en el sitio ? ???? ... o la foto fue tomada antes de su éxodo fuera de Venezuela",0.375
"me dan tremendas ganas de llorar cuando veo esa frase q dice “si un dia no vuelvo hace mierda todo” porque es tan real, yo no se si mañana cuando salga por la puerta de mi cada voy a volver, si hoy va a ser el ultimo dia q vea a mi familia/amigos, parece una locura pero es asi",0.625
"Falso: La educación sexual con enfoque de género reduciría, por ejemplo la transmisión del Virus de Papiloma Humano, causante de cáncer de cuello uterino en las mujeres, usualmente por hombres irresponsables que no se supieron/quisieron cuidar. Eso debe aprenderse en el colegio. ",0.125
"Así cuando eres un arrastrado y no sabes ni que escribir jajajajajjaja. (FD)",0.85
"uando la ciencia se utiliza para integrar a la sociedad como un gran rompecabezas, no puede no darse las gracias.  Gracias por la inclusión.",0.075
"Me estoy armando de valor para denunciar a mi cuaima, que no deja salir a beber con mis amigos, y me tiene cachifeándo y metido en la cocina todo el dia, a dónde tengo que ir? a mí concejo comunal? Q alguien me ayude por favor ",0.425
"legó la hora de que TODOS los políticos en el exilio expliquen a Venezuela de qué carajo viven? Cómo viajan por el mundo en primera clase, cómo pagan lujosos hoteles, cómo almuerzan sus familias, cómo pagan la renta, porque no veo a ninguno vendiendo empanadas, ni trapeando...",0.8
"El Omega 3 es un nutriente fundamental que debemos incorporar a nuestra dieta cotidiana. Constituye una de las GRASAS SALUDABLE con importantes funciones preventivas y de desarrollo. Dato fundamental EL CUERPO",0.025
"La Inteligencia Artificial lleva a un problema matemático sin solución ",0.075
"Algo que hoy me confirmó la hipocresía q nos domina, fue ver en la oficina del depravado explotador de menores Consejal Zisuela del Frente Renovador, una gran foto del Papa Francisco y en el cajón del escritorio una gran dotación de condones,para violar menores.",0.275
"Seamos nuestros propios padrinos y madrinas del trabajo y a estudiar para el 3 de febrero ",0.075
" Ellos misnos se escoñetan, cuando se dan cuenta se fueron a la fosa solitos, BRUTUBELOS. jalabolas.",0.875
"Quizá esa sea la diferencia entre un movimiento de desobediencia civil real y efectivo y un paripé liderado por élites que fueron franquistas antes que indepes y sus hijos que se ponen una capucha negra y se creen el Che pero lloran si la poli los detiene.",0.325
"A Gustavo Cordera lo desollaron vivo por decir una idiotez “de género”.  A este degenerado llamado Pablo Marchetti le van a dejar pasar que cuente sus perversiones incestuosas sólo porque es pareja de una diputada.  Qué asco.",0.625
"Jajajajajaja por perro sarnoso ",0.9
"¡Salido de ciencia ficción! #China planea construir su propia base lunar con impresiones 3D  ",0.05
"Me pagan ami por ser un estupido.",0.725
"Aplico para conmigo arrecho constante. ",0.65
" Demasiado mediocre",0.525
"Que sucio eres Maduro hp ...no tienes pudor trimardito ..como se te ocurre encadenarte en plena trasmisión de la misa de estos dos grandes beisbolista...sinico bastardo ... pronto pagarás por todo el daño",0.95
"Cuando el trimardito acento del puto indiano te hace doler la cabeza... Literal!",0.925
" cómplice de los abusos...desgraciado",0.7
"Ja jajajaja si dátela de guevon ...... no es lo que tú quisiste hacer con ese tuit es que fue lo que él 80% de los venezolanos pensamos o es que no te das cuenta que haber participado en esas elecciones después de lo que el pueblo dijo el 16 de julio te quedaste al descubierto",0.85
"Q carajo tiene q ver el shampoo con el eslogan ? Pesima la acción de querer subirse a una ola q nada tiene q ver con lo comercial ! Dan asco chicos !!",0.35
" No te juzgaré por ser un necio, pero podría hacerlo",0.3
" :  Quien es el estúpido que hace semejante cretinada. Así no hay inversión. Mejor si es más baja, eso benef…",0.65
" Muchas gracias jalabolas",0.975
" yo me cago mil veces en esos cabrones",0.95
"Este no deja de ser un tipo mediocre cínico necrofilo, merece la indiferencia pero eso si ser juzgado x crímenes de lesa humanidad! Miles de inocentes murieron en su guerra fallida!",0.775
" Chamo, tu sí eres mojonero!",0.925
"No pues el arrastrado, es arrastrado",0.95
" Que habrá echo ese pobre guevon",0.875
"Les voy a decir una cosa... LA VIDA ESTA TAN CABROONAAA y nosotros dejamos ir tantos momentoos cabrones por pendejooooooass!! VAMOS A VIVIIRRRR",0.425
"Periodistas ingresaron al Hospital Universitario de Caracas: ""trabajan sin luz debido a la falta de bombillos en el centro de salud, además indicaron que los ascensores permanecen dañados. ""El olor a orine, moscas es algo con lo que conviven pacientes, familiares y trabajadores"". ",0.075
"Vieja de mierda ..odio..odio ..y más odio .. ",0.95
"Jajaja díganme que es mentira. Porque es lo más estúpido que he visto ",0.575
"Mañana tengo colegio
No quiero ir",0.15
"Eso lo sabemos, pero si su uso y consumo en el país es tan recreativo, por lo que se hace adictivo e incontrolable, para q seguirla prohibiendo, si la corte legalizó su consumo y su expendio está prohibido, siempre habrá quien la venda y lo peor como pasa ahora sin control.",0.1
" Gracias, es estupido seguir usándolo",0.4
" Quien es ese desgraciado? Avisame y lo hacemo caga hna xd",0.95
" : Coño! Para el menor no hay atenuantes por confesión y para un mayor de edad si. ",0.275
"La cerveza es más interesante que la inmensa mayoría de la gente, y está más fresquita y buena.",0.075
" : En los últimos meses, se habrán podido dar cuenta, que quién realmente tiene en la mierda a Guatemala es la élite económic…",0.55
"Que mas podia esperarse de un BURRO COBARDE ",0.95
"Por sexto año consecutivo Bolivia será campeón latinoamericano de Economía, asegura García Linera ",0.075
"Te odio con todo mi corazon cecilia, hdpt",0.875
"      Propongan una ley q obligue a empresas… ",0
" dios te bendiga la paciencia por escucharte semejante coñazo aunque sea pa dormir!!!",0.575
"La persona que se aísla y no trabaja en armonía, o que trabajo solo pensando en su bienestar personal a expensas del bienestar con el cuerpo, no está cometiendo un pecado pequeño.",0.2
"estamos claros en que la gran mayoría de chicos no termina la universidad antes de los 21 años? Entonces por qué la edad límite para recibir pensiones alimenticias es 21 años? Ajustar la norma a la realidad, es epistemológicamente correcto.",0.075
"Nvidia culpara al Fornite por no exigir mejores procesadores gráficos",0
"Jajajajajaja y no que era en 2018 que mojonero ",0.95
"  Mierda pa lesbiana que se nos estan acabando las mujeres ",0.95
" Estos son los tres posibles destinos de la raza humana según la ciencia (y todos son desalentadores) #Futuro ",0.05
"  Es gilipollas y un malnacido.",0.95
"Es la prueba de fuego de la Ramera Justicia Chilena!!! ",0.7
"Dios mio las ganas que tengo de comentar en tu foto un MI AMOR LO QUE SOS BEBÉ TE AMO!!! pero soy una chica de casa respetable",0.075
" yo le daba todos los premios y balones de oro hasta que se retire por no escuchar ya el coñazo que dan sus palmeros",0.575
"Está llena de traquetos y corruptos miserables como tu familia por eso la guerra no acabara hasta que usted Y su malvado padre se desmovilicen y dejen a éste país en paz. Ladrón miserable.",0.475
"Y ahí van, como el cretino payaso arrastrado de , como , haciendo ""carrera política"" muy cómodos desde un celular, trinando con desparpajo y cinismo para convencer idiotas.",0.7
"esta mujer no conoce los límites de la belleza ",0.075
"Despertar antes de que suene la alarma es mi superpoder; uno muy pendejo, por cierto.",0.5
"Orgullo carajo Orgullo peruano  Campeon en chile",0.2
"Mi abuela me dijo mira que cacho de araña, debe ser uns araña pollito
Yo: ",0
"tirar asi de rico en la ducha con una puta, lo quiero ya",0.925
"Ayer en la noche fui al cine  a ver Réplica, aunque la película me pareció buena, habían ciertas cosas que me tenían perturbado y no eran de la película.",0.125
"las noticias hoy: ataron y violaron por dos días a una abuelita, una nena de siete años fue apuñalada después de un intento de violación y a Agustina su femicida LA ASESINÓ para después suicidarse. Esto es ser mujer, todos los días.",0.075
"Me acaban de contar una anécdota. Subieron a una niña de 10 años a un taxi para hacer un recorrido en línea recta de 8,9 km (según google maps). La niña llegó en más de una hora y la tarifa fue de 85mil gs. Luego comentó “que tonto el señor, pasamos 3 veces por el mismo lugar”",0.025
"Es el 'Born to lose', aun ganando. Viejo desgraciado y mentiroso    Hugo Chávez ",0.6
"Eres una basura de ser humano. Pajillero. Como no eres capaz de alcanzar a las personas que deseas, intentas que los demás se sientan mal. Eres un mierda, un relleno de la sociedad molesto e inservible. Tu existencia no vale para nada. No aportas nada. Solo vergüenza.",0.95
"PLANCHA DE VIAJE ¡La necesitas en tu vida! por  ",0.025
"La hermana María Luisa Piraquive, llevó a cabo un Estudio Bíblico en Lima, Perú, junto a aproximadamente 3000 hermanos, glorificando a Dios con la lectura del Salmo 50. La reunión se realizó en el Centro de Convenciones de Lima el 13 de enero de 2019.",0.05
" Yo si!!, pero de la cara de guevon que tiene y de ...., bueno una mierda mas que botar, ni los perros realengos joden tanto.",0.7
"a los profesores e investigadores en el Día de la . Estamos seguros que, como dijera ",0.075
"Soy de Jujuy. Esto (lo de los piletines y hasta baños y ollas populares en pleno centro) es lo que hizo Mili en la plaza Belgrano, frente casa de gob enseguida de asumir Morales. Estuvo casi un mes. Ni se podía pasar por allí.  Fue una tortura.",0.025
"Nunca dudas de vos misma. Déjate llevar por tu arte, por tu voz y tu música sin darle importancia a lo que opinen los de mas sobre ello, porque cuando uno hace lo que ama no necesita a nadie mas que a uno mismo para ser alguien  grandioso y con un brillo único",0.025
"Menos mal qué son pocos estos guevones",0.925
"Es que si somos mas guevones  nos morimos ",0.875
"Armani ataja en un Amistoso como si estuviese atajando en una final de Libertadores en el Bernabéu.",0
"La verdad es que cuando los Gringos quieren hacer algo lo hacen así este Rusia donde este, sino vean a Siria , cuando los gringos tiraron 60 y después como mas de 100 misiles a Sitia y estando los Rusos allí. Avión que estén allí los Rusos.",0.125
"#BIN El que se acuesta con ""infantes"", decía mi abuela africana, amanece cagado... Así razonan ellos, ""to' cagados""... ",0.7
"bueno me largué a llorar, desgraciado te odio, ojala te mueras en el infierno por hacerme esto",0.875
"  Tiene el beneficio de la duda, pero siendo capitán está en condiciones de mandarlos a la mierda, creo.",0.625
"Arroyo Culebro prometiendo la construcción del Centro de Salud en nuestro barrio, ahora además quieren recortar el servicio en el Centro donde acudimos. Acordaros cuando votéis en las próximas elecciones...",0
"El texto clásico de Jean Genet, ""Las Criadas"", regresó a los escenarios meridanos, en una puesta bajo la producción y dirección de Wendy Cruz con dos funciones en el Teatro Daniel Ayala.",0.05
"El diario El País nos ha pedido a varios escritores latinoamericanos nuestra palabra nacional favorita. El resultado es un diccionario de joyas ocultas del idioma. ",0.025
"Sigo sin creer q por un viaje de mierda haya cagado un año en serio no puedo creerlo ",0.95
"no me crece ni el culo ni las tetas lo unico q me crecen son los problemas ahre",0
"El Sistema Multipropósito Chone permite controlar el cauce del Río Grande, protege de inundaciones y dota de agua para riego y consumo humano a varios sectores del cantón Chone. Conoce más de nuestro sistema en",0
"No, los sueldos los pone el mercado por la competencia, habiendo poco paro (es decir, que todo el mundo tiene trabajo) y yo como empresa necesito trabajadores, el salario que me impone pagar el mercado es mayor puesto que necesito atraer a trabajadores de otras empresas",0
" Entonces el marrón tambien es color piel, verdad?",0.05
"jalabolas profesional y veterana de Maria CorinaYA brincara como lo que es: una loba aduladora herida y acomplejada porque ahora si va a quedar en evidencia con Delsa en el ruedo que MCM no es más que una habladora de guevonadas.",0.95
"yo creo que las que pierden el interes nunca fueron fans, solo simples oyentes que se creian FANS desesperados por pertenecer a algun grupo social o por simple moda. esa clase de personas no pueden tener exito en la vida por que no tienen estabilidad en sus decisiones",0.3
"El más pendejo de todos ‍️ ",0.9
"¡Es lo más divertido e irónico! No te acomplejes por no tener su imaginación... ¡no lo leas y ya!",0
"Mamá, escribo esto para hacerte saber que yo jamás me iría sin avisar, jamás apagaría el teléfono para evitar que me llames, jamás me iría de ti dejándote con el corazón roto. Mamá si ya no vuelvo, no les creas.",0.2
"En nombre de esa Loca yo me prendo un blont",0.7
" Este muchacho esta profundamente enfermo, no les parece que es demasiado sadico??' ",0.7
"  Jajajaja yo te quiero muchísimo... te veo hoy desgraciado.",0.375
"""Nunca te des por vencido en un sueño sólo por el tiempo que tomará para lograrlo. 
El tiempo pasará de todos modos.""",0.075
"Uno de los que contribuyeron al prestigio cultural del idioma ESPAÑOL, fue el CATALÁN Boscán, desde 1526. ",0
