text,percent
"En el siguiente artículo, Carlos Sierra busca determinar cuál es la mejor fuente de fertilizante nitrogenado para la lechuga, considerando que este cultivo hortícola requiere importantes cantidades de este nutriente para su correcto desarrollo.´",0
"Cuando leo la palabra ""irrevocable"", me es inevitable pensar en Chiabes. Maldito Maduro!",0.75
"Inauguran Convención del Sistema Estatal del Deporte  #MÁSNOTICIAS #Veracruz #México",0
"La ruptura de Rafael Solís ""es un terremoto político y moral"" para la dictadura, afirma la excomandante guerrillera Dora María Téllez. El es un ""testigo calificado"" del colapso del sistema judicial y de juicios a los presos politicos que deben ser anulados",0
"MARICO ES BAD BUNNY AJKSJAJA",0.8
"  Upa tan así amigo? Al final la bruja te tiene cagando",0.7
"   No seas necio compa, entiende razones, no es factible reducir los prec… ",0.05
"Por cierto, en varias partes de Lima empiezan a aparecer pintas del tipo “Con Vizcarra no hay trabajo” o “Con Vizcarra medicinas caras”. ¿A quien le interesa generar caos?",0
"5 años de risas, alegrías, tristezas, agradecimientos. No tengo palabras para expresar todo lo que siento por ustedes. A mi vida, le dan ese toque de felicidad que me hacía falta. No estoy desde el pricipio pero les prometo que estaré hasta el final. Los amo",0
" Tu tienes que se marico de verdad Chu jajajajajaja",0.875
"Lo vivido hasta el momento en estos 20 años ha sido el preludio de lo que viene, el gobierno en escandalosa minoría",0
"    Pues guevón los mismos que recibieron los dineros en lo… ",0.7
"En la noche la GNB hizo acto de presencia en la estación La Rinconada a fin de evitar que la molestia de decenas de usuarios se convirtiera en un caos. Pero parece que la situación pasó a mayores!!!",0
"La Dirección de Tecnología de la Informática (DTI) tiene los siguientes horarios disponibles para Beca Trabajo:",0
"Martin  nuestro hijo desde ya haciendo campaña con sus amigos del Colegio ️ Jorge Figueroa Clausen",0
"Lectura recomendada, sitúa en su contexto el acompañamiento de instituciones como el #INADEM y #PROMEXICO, hoy en extinción por el gobierno de México, que coadyuvan a catapultar el talento mexicano.  ",0
" Asco maldito chavista de mierda",0.95
"Pobre guevón este, justificando la maldad innata de algunos seres humanos en condiciones económicas o sociales. Ejem de que su torpe comentario no tiene sustento hay muchos, pero igual estas haciendo politica.  Mas bien mire como sale del problemita de los embargos de contraloria",0.65
"“La Iglesia está presente con la enseñanza en los sectores más vulnerables, hasta en la universidad.” dijo el Cardenal en el nuevo programa",0
"Por que ese sepulcral silencio de Ramos Allup, Capriles, Rosales y otros....
.",0
"Me hubiera encantado que este video llegue a mi inicio de otra manera... eras arte puro, habia oro en vos y tenias mucho que vivir prince. Por vos y por todas sigo luchando, basta de matarnos. Estos hijos de re mil mierda se van a caer!! Flor agregado,",0.625
"   La misma regalada.",0.125
" Aca lo tenes, justificando reacciones de mierda con el ""me tuvo que hacer algo para que reaccione asi"" no avanzamos mas.",0.425
"La Organización Mundial de la Salud afirma que 1 de cada 4 personas en el mundo tiene un trastorno mental. Este año cuida tu salud mental, suelta, aléjate, quiérete, sánate y pide ayuda ¡siempre hay una salida!",0
"Una compañera de universidad necesita urgente donantes de plaquetas después del lamentablemente fallecimiento de su madre el 8 de enero. Quedaron debiendo 63 donantes y esos serán cobrados, les ruego por favor difundir para todos aquellos que puedan vayan a donar. Dejo la Info",0
" Los 10 inventos estadounidenses que transformaron la vida de millones de personas en el planeta entero #Ciencia ",0
"SABIAS URIBE QUE EL america de cali metiendo al mexicano en la organizacion tiene hinchas ese es el nuevo uniforme QUE PARA EMPEZAR VENGO USANDO ESE COLOR ROSA SUAVE DESDE 2016 como uno de mis uniformes. QUE VERGUENZA AJENA EL ROBO Y COPIA.",0
"No porque sea navidad está bien que estés de regalada.",0.875
"Mi primer chonqueo fue después de un party de despedida de año... Vamos de camino a casa y a mami le da con bajar los cristales. Se me viro todo y le vomité toda la guagua a papi",0
"La cerveza es más interesante que la inmensa mayoría de la gente, y está más fresquita y buena.",0
"En mi visita al Jardín de Niños Daniel Lara Salguero, reconozco el trabajo colaborativo que se presenta en las escuelas hidalguenses y que se replica en el gobierno que encabeza , representando un factor que permite que Hidalgo se mantenga como un referente educativo. ",0
" Idiota está vieja",0.9
"y a día de hoy es una prueba de la manipulación tan tremenda que sufrí cuando yo no quería perder la virginidad",0.125
"Y la dejan operar libemente por el mundo(la peor mafia del planeta, la deja irse del país y ""hablar"" con autoridades. Eso no existe ni en los libros de ciencia ficción.Lo mismo Ramírez, quien es la persona que más información dañina tiene contra el régimen (Aparte de Diosdado);",0
" Jamas lo he hecho. No soy cachapera jaja",0.4
"Y que pasa? El virus del izquierdismo barato les gusta?Y todavía están aquí? esa revolución boba,necesito más de veinte años para destruir,ahora cuantos más para desaparecerlo?""Tonta sur""fue juguetito de Cháves,arriba duque el pueblo latinoamericano   contigo",0.425
"La verdad es una Luz que se convierte en antorcha para alumbrar los caminos de la buena y santa voluntad, el querer, el sentir, la paciencia y sobre todo el amor dentro de la mente y en nuestros corazones. ..hasta la victoria siempre....las antorchas de la velas encendidas llevan un mensaje de luz para quienes se encuentren en la oscuridad; sirviendoles en una mesa los brazos de Unidad...sólos no podrán existir, es necesario tener las luces de la Verdad..",0
"Totona= +cómodo 
Pipi= +práctico",0.4
"  De desgraciado tiene poco, me han dicho que lleva  una vida últimamente...",0.425
"qué gafo es no poder dormir toda la noche lmao",0.575
"Yo- y bueno si te gusta la droga un cacho que le vas a hacerCgcdluz- toy enamorao",0.075
"Mamarracho de que paraiso fiscal sacaste el dibero para donarlo",0.45
"Pero es que es como guevón, ¿mandan entonces el gallo por correo certificado?. Es una flota no un vuelo clase ejecutiva.",0.375
"Movía su rostro a los lados soltando buenas carcajadas de las cosquillas que le daba esos suaves y cariñosos besitos, nunca antes se había sentido tan querido y mejor atendido, menos después de una terrible pesadilla.  Le sopló en la cara divertido en el momento",0
"Están todos invitados a participar en el VII Simposio Latinoamericano de Musicoterapia que se realiza del 14 al 18 de enero. ¡Solo por este año el mismo sera gratuito!   ¡Solo hay 250 cupos disponibles!",0
"Psicópata malnacido ",0.875
" Jaja, cacho contento",0.25
"Mejor es oír la reprensión de sabio que la alabanza del necio.",0.125
"Es triste que lo digas cuando tu cuerpo es el ideal de belleza. ",0.325
"Hasta 7 mil pesos pagaban ""Los Caudillo"", la banda dedicada al 'huachicol' en #CDMX, por custodiar pipas con combustible robado. ¿Cómo operaban? Un trabajo de",0
"  Mojonero, yo estoy en bejuma y eso no pasó",0.7
"Gallardo: “No le presto atención a las cargadas. Nunca me tomé el trabajo de festejar fracasos ajenos, me parece de mediocre. Seguro otros hinchas lo hacen porque están dolidos, pero los entiendo porque perdieron la final más importante de la historia”.",0.075
"Enfermo, Acosador, incestuoso, Abortero y por si fuese poco hace apología al terrorismo portando una remera de Montoneros. Ese tipo es TODO lo que está mal. ",0.05
" Con el buen color rojo que me recomendaste ",0
"El conocimiento a través de la experiencia es un nutriente poderoso para la mente y la percepción existencial de tu universo interior... Yo soy Mystika",0
"Pasen y lean! increíblemente depravado. No me entra en la cabeza que un padre piense así  y lo deje plasmado en un blog.. El polémico texto de Pablo Marchetti, esposo de Victoria Donda, sobre su hija ",0.275
"Cambiar el idioma en que se muestra nuestro PC con Windows 10 es muy fácil con sólo seguir estos pasos ",0
"¿se acuerdan cuando la moda de servir empanadas en un frasco nos parecía imposible de empeorar? ",0
"El venezolano David Zalzman acaba de ser seleccionado en el draft por los Portland Timbers, viene de jugar en la Universidad de Memphis. En Venezuela fue parte del Dvo. Anzoátegui y jugó con la Vinotinto el mundial Sub-17 en 2013 ",0.05
" MMGVO ES MI PURE",0.975
"Lo mejor de caso cerrado es mi parte favorita de la tarde.",0.075
"Odio a los carajitos los odio tanto y si hablan como los teletubbies y son unos tarajayos peor aún, muchacho mongolico",0.7
"cual es una buena edad para dejar de ser virgen? — La virginidad es un invento machista ",0.15
"Es el deporte más lindo si o si ",0
"Estoy en un Mc Donals comiendo y tienen música de Diciembre  todo volumen, lo raro es que en mi cajita feliz no me salió una botella de Whisky!!!!",0
"Ya llego esta con su feminismo de comiquita.",0.375
"MALDITO MADURO TU NO TE VAS A MORIR DESGRACIADO, TIENES Q VIVIR EN CARNE PROPIA LO QUE PADECE VENEZUELA MALDITA BASURA.. TIENES EL ALMA PODRIDA..",0.95
"Si yo ni idea, capaz sos un hijo de puta jajaj pero es verdad que lamentablemente hay algunas personas que aprovechan todo esto para ensuciar a otras que nada que ver.",0.575
"A esta mujer hay que hacerle un monumento. Cada vez que necesito un artículo científico, ¡voilá!, ahí está ella con el artículo en medio segundo. De verdad, no os imagináis el tiempo que nos ahorra ",0
"  Que rica te quiero comer todo el día mamasita chuparte esas tetas darte precio el culo y la panocha",0.95
" Gracias, me acordaré de ti cada vez que tire de la cadena.
Mamarracho",0.7
"En 2018 Chile se desacopló del desempeño mediocre de la región: creció más que América Latina (e incluso más que el mundo) ",0
"Entonces ahora tenemos q esperar 7 días para el otro capítulo y cuANDO LLEGUE ESE DÍA tendremos que esperar otros 7 y así sucesivamente, bueno no sé ustedes pero no sé q haré, me voy a comer las uñas, me voy a arrancar los pelos, QUÉ DESESPERACIÓN!!",0
"#Urgente  Senador pide a las autoridades en EEUU tener a como auténtico presidente de Venezuela.  Noticia en progreso",0
" Atrévete, desgraciado.",0.975
"Esta prostituta se ha metido de todo en estos 20 años revolucionarios. Hasta la mano de Dios. ",0.9
"Nunca vas a ser feliz si piensas que la felicidad es tener a alguien a tu lado.",0
"Esta gestión es solo por Caracas? No es posible por región? Me interesa Maracay...",0
"Pagó 80 millones por Bale en el futmondo y se lesiona, soy un desgraciado",0.4
"Me encantan las fotos cerradas que publican. Muestren una amplia a ver que tanta gente es? .. a ver si son más que los que te gritaban en el Congreso¡",0
"Ya esta, se armo una grieta enorme que se venia formando hace rato. Están con las pibas o estan con los soretes. Ya no hay tiempos para tibios, acompañen o mueran con toda la mierda",0.875
"El feo del gordo me contesta las menciones y ya desaparece. . . Quiero el divorcio, no sé por qué acepté casarme con él.",0.3
" :   Y hasta pelo le crece, bien gordo el desgraciado.",0.875
"Llegue a hacerme la RX! estaba cerrado... toque la puerta un par de veces. Mire el horario y ABREN A LAS 10! ",0
"Redes neuronales y algoritmos para reconocer a individuos en aglomeraciones con una precisión de casi el 100%",0
"Claro que es normal llorar y después irse a dormir.",0
"MATAR AL PUEBLO DE HAMBRE... es el plan macabro de la oposición en unión con los hdp comerciantes..",0
"Que coñisimo de su madre el trimardito este!! Tu si vas a comer bien desgraciado !! Para ti y tus secuaces la van a pasar de lo lindo!",0.9
"todo el día tengo sueño menos en la noche ksad",0.075
"PENSÉ QUE ERA LA ÚNICA ANORMAL LPM JAJSJJA YSI ",0.575
"Tuiteros que como no pueden meter cizaña contra Guaidó porque no tendrían quórum siguen dele que dele su obsesión contra Capriles, Ramos, Falcón, ¿no entienden que la esperanza es que estemos unidos contra la tiranía? Tan preparados y pensantes pero tan resentidos y tan chismosos",0.075
"Me parece que es la forma de entrenamiento a las redes neuronales... Y ya estoy un poco paranoico porque le dieron el dato de cuanto cambias en 10 años",0
"Alan García sabes muy bien que a un presidente no se le puede investigar mientras ejerce mientras que tu en tu Gobierno con los petroaudios te hiciste el loco no dijiste nada maldito ladrón ya cállate padaso de cagada ladrón ladrón",0.65
" Malnacido vas a pagar esto en la cárcel",0.75
"Que carajo exige este malnacido en relación a otro malnacido? Ojalá despachen a Del Pino para salir de otra plasta.",0.725
"marico de pana nadie se imagina todo lo que yo gozo con los stickers y los gifs",0.075
"Natalia b el aburrido petroburro llora por su camarada y cadamas viejo guevon vuscando la personeria juridica muy de malas quedo colgado",0.325
"El azúcar está en todos lados, y nos estamos acostumbrando cada vez más a consumir productos altamente dulces, incluso sin darnos cuenta... ",0
"""Queridos amigos: Si conocen a algún estudiante de bachillerato que quiera estudiar economía en la Universidad San Francisco de Quito, le ofrecemos esta oportunidad para ganarse una beca del 100% al primer",0
"#CICPC Sub Delegación Maracaibo detiene a menor por Hurto de teléfono.  Mediante investigaciones de campo por parte de los funcionarios de este cuerpo detectivesco, se logró la…",0
"Qué degenerado mental lo llama patata? LAS PATATAS SON REDONDAS",0.65
"Esos médicos deben ser despedidos! Las Regiones deberían hacer lo mismo, para acabar con esa corruptela. Solo Cilloniz en Ica lo hizo. ",0
"Tanto dinero que gastó mi mamá en la universidad, cuando lo más sencillo era comprarme la revista semanal TVyNotas para triunfar en Confetti y construir mi futuro.",0.05
"Voy a empezar a dar Uf a todo mmgvo q hable mal de Maria Corina... Xq si los demás hicieran algo para salir de esta mierda listo! Pero son una cuerda de webones todos becerriados q la critican sin base cuando HA SIDO LA ÚNICA q le ha cantado sus vergas al chavismo! PENDEJOS!!!",0.925
"No hay nada más estúpido que justificar  que un hombre sea mierd* con vos.",0.175
" A carajazo limpio si se pone ""comiquita"".",0.325
"  Se llama hombre de paja. Es un recurso repugnante en una argumentación. Consiste en atribu… ",0.25
" Maríca si, o sea. Desubicadisimos. Un carro del 77 y que 3300$",0.4
"Para solucionar la crisis, Maduro lanza la misión ""Venezuela bella"", para pintar las paredes de 50 ciudades y sembrar matas.   Cuando tengas hambre, te comes la mata.",0.05
"Así reaccionaron en Twitter tras expulsión de Almagro: “Traidor y arrastrado”  ",0.275
"  cuando te cacho la cuca ",0.875
"Algunos se burlan d esos venezolanos q por 2 años seguidos Maduro  ha engañado con el fulano pernil q nunca llega.Pero esos q se burlan,en su ignorancia y mala fe, no se dan cuenta q ellos tiene más d 6 años engañados con el ""falta poco"" q tampoco llega. ¿Quiénes son los idiotas?",0.325
"  Hay que ser muy guevon en la vida para pagar por semejante servicio de mierda.",0.725
"Les voy a decir una cosa... LA VIDA ESTA TAN CABROONAAA y nosotros dejamos ir tantos momentoos cabrones por pendejooooooass!! VAMOS A VIVIIRRRR",0.3
" Estoy espesa y no lo entiendo bien. Eficiencia, honradez? Me pierdo en el idioma. Hora y 25...veinte minutos reales?",0.125
"Deberían de hacer un OT pero de los que no sabemos cantar una mierda y que hagan el milagro de enseñarnos dentro aunque sea a entonar. Que divertido seria.",0
" : Che sos idiota o lastimas a la persona que mas te banca?",0.65
"Luego de eso llamé a mi mamá y me fui rápido porque venía a almorzar donde mi bisabuela. Me fui bien rápido, pero noté que los chicos también iban por la plaza de armas y lo siento, no me resistí y sin mentirles, me acerqué sólo porque quería mirar a Renjun",0
"El deporte ",0
"Si la verdad que soy una persona complicada. Oculto mucho mas cosas de las que digo,quizas a lo mejor por eso,a veces, me gane el estres. Porque callar no es tan divertido cuando sabes que si hablas,a nadie le interesaria escucharte.",0.2
"Con mi novia empezamos un emprendimiento para juntar plata ya que nos esta pegando la macrisis y vendemos cosas hermosas, de buena calidad y económico.  Les dejo algunas fotos y la pagina en el comentario.  Si nos quieren ayudar con un RT se lo agradeceriamos. ",0
" Soñé contigo. Un sueño muy realista. — ¿Qué soñaste? — Que éramos perfectos extraños. Como si nunca nos hubiésemos conocido.  Carlos A. Sevilla",0
"El mardito guason bebe",0.7
" Necio como la caca, igual que tu presidente..",0.8
"que vergüenza y asco me da mi propio primo otro machito más resultó ser",0.4
"El peronismo es la alternativa para recuperar el crecimiento de nuestra Provincia. Con visitamos la empresa Mar Picado de #MardelPlata para conversar con los trabajadores del sector pesquero.",0
"El día de hoy miembros de la Junta Directiva 2019 de #JCIMERENDON  estuvieron en el programa Buenos Días América Latina! Agradecemos a JBN Televisión por la oportunidad para dar a conocer nuestra organización local. ",0
"Hoy en el Aeropuerto un ejemplo de la falta de autoridad, falta de seriedad como país que ahora se precia de ser turístico,quizás cierta intervención de la dictadura sindical, todo mezclado provocó que se informara que estaría ¿¡CERRADO!? mínimo 24 h por radar roto.Todo un bluf.",0.05
"Ya no me llamo Diego Ahora me llamo 'Rudo' y no por la nariz roja si no por los Cachos y el papel de guevon que estaba haciendo.",0.525
"Este mate wea debe ser delincuente o traficante o un hombre degenerado o simplemente un zurdo, que no respetan a nadie, a una persona normal no pasa por esa situacion, el tipo es pillo y sabe que lo estan grabando, asi son las lacras.",0.2
"Gallardo tiene el choto como el negro de WhatsApp",0.65
"La que sea mi novia jamás tendrá cuernos, mi madre crió un alcohólico no un maldito infiel.",0
"me dan tremendas ganas de llorar cuando veo esa frase q dice “si un dia no vuelvo hace mierda todo” porque es tan real, yo no se si mañana cuando salga por la puerta de mi cada voy a volver, si hoy va a ser el ultimo dia q vea a mi familia/amigos, parece una locura pero es asi",0
"Alguien me explica la belleza de Ester Expósito???? Es una grosería ",0.15
" Esa es una de las teorias ya que la otra dice ser por Eugene The Jeep un personaje con super poderes de la comiquita popeye",0
"eres una retrasada estupida, te crees la gran vaina , cuando en verdad eres senda tetona estupida",1
"#SeSolicitan 20 #DonantesDeSangre para Morella Cordero de Taylhardat en la Policlínica Metropolitana de #Caracas -",0
"España impondrá una costosa multa a quienes maltraten o abandonen a su mascota – GRANDIOSO * ",0.125
" Lo dice el Stalin latinoamericano",0
" Así de caligueva vivan las cholas njd y muerte al comunismo ",0.65
"Capriles??  Nahh lo tuvo porque fue el unitario en ese momento,  pero esa popularidad se le fue abajo cuadro se rajo!",0.325
"Ya 1 me la lleve a febrero, ojala mañana apruebe la otra por que si no me corto las tetas . ",0.525
" Yo también quiero que alguien pro me haga la lectura de la carta astral. Pero también me gusta aprender a leerla",0
"Con algunos de estos testimonios - como el de Caparrós y el de Gamboa- pienso que los escritores no siempre son los más indicados para hablar del idioma que se habla en su país: ",0
"En unión cívico-militar derrotaremos el pretendido golpe de estado, que ha puesto en marcha el cartel de Lima y el imperialismo norteamericano, contra la Patria. (+IMAGEN) ",0
"Niño palestino es asesinado por Israel por disparo en la cabeza - Resumen Latinoamericano ",0.075
"  Pues yo lo vi muy mariquita ay ay yo mejor me voy pinche maricon",0.95
" Detesto ese intento estúpido se superioridad. Si es tan facil que se metan a esa área.",0.65
"El bolsillo de mi camisa emana un agradable aroma a buena marihuana",0.075
"Es indignante las decisiones administrativas que está tomando la universidad, y las limitantes hacia los estudiantes.",0
"Una weona loca drogadicta y llena odio con razón le va como las wevas en su vida, amargada de mierda. ",0.875
" Vieja de una re camionada de mierdas de caballos, podrida me tiene. Esta buscando q la golpee!! ",0.95
"Dos incendios fueron sofocados. El primero se trató de una camioneta abandonada misma que se incendió en Chachapa, Amozoc. El segundo en una fábrica de muebles ubicada en las calles Laguna del Carmen y río Suchiate en la Col. Manantiales de San Pedro Cholula",0
"Esa es la sociedad ignorante, resentida, ingrata e incapaz, que votó por el presidente más desgraciado de la historia.  ¿Quién nos va a proteger de ellos? ",0
"  Y quien es este viejo mal parido? A ok anda y le jalas bolas a ramos allup guevon",0.95
"   Algún necio que corría por aquí, sí. Ya no me acuerdo; ésto se ha llenado d… ",0.15
" Sea necio",0.575
"Me acuerdo cuando el año pasado cuando se convocaba paro nacional los comerciantes de mi pueblo ninguno cerraba por que ""si no abrían no comían"". Hoy más del 70% esta cerrado debido a que la inflación no los ha dejado trabajar. No saben si abrirán. Es para reflexionar la cosa.",0.075
"Odio los sapos ",0.05
"Opino que te faltó oxígeno al nacer y que eres un imbécil desgraciado que no entiendo como te haces llamar periodista. El mundo necesita más gente como Angela y menos gente como tú, predicadores de odio ignorantes e incultos. Por favor, bajate del autobus de la vida. Gracias.",0.95
"que onda esa gente que le abriste hasta las puertas de tu casa, los hiciste parte de tu familia, les distes de comer, los acompañaste en sus peores momentos y te terminan cagando, que ser de mierda tenes que ser para cagarte así en el otro",0.7
"Años? Nojoda apenas te quitaron la teta fue que te pusiste rebelde y no vengas con que renunciaste, porque de ese cargo simbólico de mierda al que te relegaron hasta un guachiman hubiese renunciado",0.7
" El gordo dijo que no podía ",0.2
" : Clase loquera esas personas que te dicen ""te olvidas mí"" como que uno les va andar rogando el culo para hablar. No anden maman…",0.55
"Jajajajaja que cagado",0.95
"Perdí de todo este año, menos mi virginidad.",0.075
" comienza su programa de entrega de efectivo en el municipio de Maicao con apoyo de a los migrantes provenientes de Venezuela, retornados y comunidad de acogida en mayor situación de vulnerabilidad ",0
"   Empezaron con el degenerado Zapatero a darle homenajes. Ahora este títere lo qu… ",0.725
" que marico de madrid alo JJASDJSKADJAKJS",0.825
"Lo miro a papá y me hace cagar de risa porque es una hilacha el desgraciado pero enseguida te cojudea jajajaja",0.45
"  Pero que estúpido xDDDDDDDD",0.25
"Siéntete seguro de cantar tus canciones preferidas en el idioma quequieras, sin tener que buscar la traducción",0
" Para que me dijiste que venias mongolico",0.8
"Cuando se acaba la salsa de ajo y tu no has terminado tu empanada ",0.2
"Increíble como este perro tranquiliza a esta bebéSon puro amor. ",0
" A ustedes deberian aplicarsela por agitadores y prensa ramera.",0.65
"Busco trabajo URGENTE. Soy Lic. en Comunicación social, posgrado de RRHH. Resido en Rosario. Moza, Administrativa, secretaria, Niñera, me sirve. Les pido por favor un RT solidario. Gracias! ",0
"yo no soy psicoanalista   Y ese tema igualmente no lo manejo. En tren de empezar a estudiar. Acepto recomendaciones se lectura para principiantes",0
" Pidele un poco a Jesu que está forrado el desgraciado ",0.525
"Los Sobresueldos no fueron ni son fantasìas vieja hija de la gran puta ladrona, deberìan de devolverle al pueblo salvadoreño lo robado!",0.9
"  Pues gracias a Dios van a perder teta q bien le pagaba .",1
"Le iba a presentar a mi familia hoy en la novena de mi casa y me saco el culo, eso le pasa a uno por guevon",0.7
"Yo no voy a nombrar a nadie porque todo lo que tenga que ver con la vida política de Venezuela es Castroestalinista. O acaso hay partidos políticos que propugnen la libertad, la Soberanía, la honradez?",0.125
"Llega uno de los desplazamientos especiales del año.  Este domingo ponemos rumbo a Huelva para apoyar a nuestro frente a un gran club y a una gran afición como es el No te quedes en casa y disfruta del fútbol de verdad. ¡On tour Huelva! ",0
"Déjate de joder que belleza  ",0.625
" Estúpido, no entre en contradicciones epistemicas.",0.45
" JAJAJAJAJAJA Es mas divertido que digas eso",0
"Es el pretexto más tonto. Si te quieres sentir bien, no te andas tomando lo que se te cruza. ",0.45
"Quién es ese tipo? Malparido...",0.65
"Makoke no sale del bucle de los argumentos, de sus orejas, de llamarla fea y de tender la mano...  No da para más. ",0.125
"Los volcanes de México son parte del llamado ""Cinturón de Fuego"", una zona propensa a la actividad sísmica y volcánica . Conoce más de esta larga cadena tectónica con",0
"   El odio se lo ganan todos los días cuando escriben y Jalabolas como tú !… ",0.7
"TRIMARDITO GOBIERNO....NO HAY SEGURIDAD EN LA VÍAS DE VENEZUELA!!! QUE DESASTRE... SERÁ QUE SOMOS MENOS LAS PERSONA..",0.7
"Me apoyan?? Necesitamos darle like y tener muchas visitas para promover la lectura y tambien ganar el concurso de mas VIEWS en la escuela!!!",0
"   No creo q sea tan reverendo, lo veo y le tiro el carro de fijo",0.15
"  Por desgracia no serás el único tonto que dirá algo semejante o peor!!!",0.8
